Field,Alias,Allow NULL,Allow 0,Data Type,Attribute Domain,Description,Source
station_id,Station ID,No,N/A,Text,,Unique station identifier. Sourced from the curated stations_v1 layer in tod_database.gdb. Stations manually added during the Step 1 GIS review retain the ID assigned at that time.,Step 1 GIS review → Step 2 — 2_tod_stop_and_access_assignment.ipynb → Step 3 — 3_tod_station_assignment_reintegration.ipynb
station_name,Station Name,No,N/A,Text,,Human-readable station name sourced from GTFS or assigned during the Step 1 manual GIS review.,Step 1 GIS review → Step 3 — 3_tod_station_assignment_reintegration.ipynb
location_type,Location Type,No,No,Integer,GTFS location_type: 1 = Station,"GTFS location type. All records in this layer are location_type = 1 (Station). See https://gtfs.org/documentation/schedule/reference/#stopstxt for reference.",Step 1 — 1_gtfs_tod_stop_classification.ipynb
manually_added,Manually Added,No,Yes,Integer,"0 = sourced from GTFS; 1 = manually added","Flag indicating whether the station was manually added to the curated GDB during the Step 1 GIS review rather than sourced natively from GTFS. Manually added stations include SFMTA light rail stops not co-located with a BART station, VTA light rail stops, and BRT stops.",Step 1 GIS review
geometry,Geometry,No,N/A,Geometry (Point),,Station point location in EPSG:4326.,Step 1 GIS review → Step 3 — 3_tod_station_assignment_reintegration.ipynb
